[
  {
    "bandwidth_mhz": 20,
    "channel": 6,
    "csi_iq": [
      -11,
      49,
      -99,
      -116,
      13,
      -64,
      -89,
      40,
      41,
      -18,
      101,
      55,
      -31,
      67,
      -37,
      -29,
      9,
      -80,
      12,
      57,
      -112,
      -7,
      -88,
      -95,
      14,
      96,
      18,
      23,
      13,
      -8,
      53,
      97,
      41,
      68,
      -91,
      103,
      8,
      -54,
      -14,
      53,
      -23,
      76,
      -26,
      -34,
      49,
      -45,
      5,
      101,
      -119,
      -89,
      98,
      17,
      -89,
      45,
      -124,
      -87,
      127,
      119,
      15,
      -122,
      125,
      52,
      95,
      57,
      67,
      39,
      -92,
      122,
      -71,
      126,
      63,
      81,
      20,
      -126,
      119,
      -44,
      58,
      51,
      4,
      44,
      -88,
      -22,
      120,
      -47,
      -106,
      5,
      0,
      111,
      -2,
      77,
      57,
      -85,
      -34,
      65,
      -24,
      -83,
      55,
      94,
      -114,
      -40,
      -76,
      -89,
      35,
      88,
      22,
      17,
      70,
      49,
      -108,
      64,
      59,
      77,
      -115,
      -90,
      -15,
      15,
      79,
      44,
      69,
      -4,
      -111,
      58,
      110,
      125,
      -98,
      82,
      38,
      23
    ],
    "device_ts_us": 0,
    "first_word_invalid": false,
    "host_ts_ns": 1786003200000000000,
    "link_id": "rx-a",
    "ltf_mode": "HT",
    "noise_floor_dbm": -96.47,
    "quality": {
      "notes": [],
      "parse_ok": true,
      "sequence_gap": 0,
      "timestamp_monotonic": true
    },
    "rate": 54,
    "rssi_dbm": -62.94,
    "rx_id": "rx-a",
    "schema_version": "1.0.0",
    "secondary_channel": null,
    "seq": 0,
    "session_id": "session-mock-fixed-v1",
    "source_mode": "mock",
    "tx_id_hash": "sha256:f69a37b052c502bed814991c797431b57174118fe41fae92be251727817e64aa"
  },
  {
    "bandwidth_mhz": 20,
    "channel": 6,
    "csi_iq": [
      -100,
      14,
      62,
      123,
      122,
      -60,
      -102,
      -30,
      7,
      -123,
      -13,
      8,
      105,
      -117,
      120,
      126,
      -73,
      41,
      -92,
      16,
      85,
      -111,
      44,
      -19,
      77,
      106,
      74,
      -34,
      54,
      83,
      115,
      -33,
      95,
      -24,
      12,
      -100,
      -21,
      -66,
      -25,
      -57,
      -38,
      -114,
      105,
      92,
      33,
      49,
      45,
      -15,
      94,
      46,
      -46,
      -90,
      0,
      77,
      -73,
      123,
      125,
      -26,
      -85,
      58,
      -127,
      -15,
      77,
      97,
      113,
      52,
      -114,
      49,
      -15,
      -116,
      6,
      47,
      -47,
      76,
      -77,
      -77,
      -2,
      84,
      -31,
      114,
      -93,
      -31,
      116,
      -8,
      40,
      5,
      -51,
      -105,
      -60,
      33,
      -26,
      -15,
      -40,
      123,
      -45,
      -54,
      -112,
      58,
      -2,
      66,
      44,
      -108,
      98,
      -53,
      -106,
      21,
      -59,
      -66,
      13,
      59,
      -12,
      71,
      -102,
      41,
      123,
      6,
      63,
      -2,
      26,
      -74,
      -75,
      -78,
      -66,
      -68,
      -46,
      79,
      -111,
      9
    ],
    "device_ts_us": 10000,
    "first_word_invalid": false,
    "host_ts_ns": 1786003200000100000,
    "link_id": "rx-a",
    "ltf_mode": "HT",
    "noise_floor_dbm": -91.04,
    "quality": {
      "notes": [],
      "parse_ok": true,
      "sequence_gap": 0,
      "timestamp_monotonic": true
    },
    "rate": 54,
    "rssi_dbm": -59.91,
    "rx_id": "rx-a",
    "schema_version": "1.0.0",
    "secondary_channel": null,
    "seq": 1,
    "session_id": "session-mock-fixed-v1",
    "source_mode": "mock",
    "tx_id_hash": "sha256:f69a37b052c502bed814991c797431b57174118fe41fae92be251727817e64aa"
  },
  {
    "bandwidth_mhz": 20,
    "channel": 6,
    "csi_iq": [
      19,
      32,
      -90,
      -88,
      40,
      10,
      -4,
      21,
      -111,
      -16,
      -124,
      -45,
      -76,
      69,
      38,
      47,
      85,
      -93,
      -72,
      15,
      -90,
      -115,
      10,
      -69,
      -38,
      -49,
      27,
      -5,
      -44,
      -38,
      -92,
      63,
      -26,
      30,
      -52,
      40,
      -63,
      115,
      -105,
      9,
      95,
      37,
      -55,
      69,
      -76,
      111,
      -71,
      -31,
      -105,
      93,
      56,
      -17,
      -106,
      113,
      -118,
      -25,
      -99,
      74,
      -78,
      -20,
      -118,
      -114,
      20,
      -77,
      119,
      122,
      -9,
      -128,
      64,
      111,
      -54,
      -39,
      52,
      99,
      -125,
      -70,
      64,
      25,
      37,
      123,
      3,
      77,
      -63,
      99,
      124,
      -122,
      69,
      28,
      26,
      105,
      -63,
      -71,
      38,
      81,
      109,
      -38,
      -107,
      -63,
      71,
      89,
      -16,
      34,
      -34,
      -87,
      33,
      2,
      88,
      -84,
      111,
      -74,
      -69,
      74,
      -53,
      72,
      0,
      -72,
      124,
      -1,
      87,
      22,
      -113,
      -97,
      -46,
      27,
      -122,
      -17,
      -47,
      -29
    ],
    "device_ts_us": 20000,
    "first_word_invalid": false,
    "host_ts_ns": 1786003200000200000,
    "link_id": "rx-a",
    "ltf_mode": "HT",
    "noise_floor_dbm": -95.12,
    "quality": {
      "notes": [],
      "parse_ok": true,
      "sequence_gap": 0,
      "timestamp_monotonic": true
    },
    "rate": 54,
    "rssi_dbm": -64.71,
    "rx_id": "rx-a",
    "schema_version": "1.0.0",
    "secondary_channel": null,
    "seq": 2,
    "session_id": "session-mock-fixed-v1",
    "source_mode": "mock",
    "tx_id_hash": "sha256:f69a37b052c502bed814991c797431b57174118fe41fae92be251727817e64aa"
  },
  {
    "bandwidth_mhz": 20,
    "channel": 6,
    "csi_iq": [
      110,
      -70,
      -105,
      77,
      -38,
      63,
      33,
      3,
      50,
      125,
      70,
      -120,
      8,
      -120,
      123,
      12,
      -124,
      3,
      -80,
      117,
      -94,
      -116,
      -70,
      -56,
      82,
      -91,
      -121,
      87,
      -47,
      -24,
      -77,
      107,
      -98,
      27,
      63,
      22,
      -98,
      38,
      23,
      -117,
      101,
      54,
      -30,
      93,
      52,
      -51,
      -115,
      -34,
      -85,
      -56,
      18,
      30,
      22,
      54,
      -6,
      39,
      3,
      -91,
      -122,
      -62,
      -90,
      -112,
      -45,
      58,
      48,
      -41,
      60,
      7,
      -86,
      51,
      13,
      26,
      2,
      -11,
      3,
      -91,
      75,
      67,
      90,
      29,
      -123,
      39,
      -114,
      -33,
      92,
      -56,
      114,
      14,
      98,
      -68,
      -44,
      -31,
      119,
      92,
      -114,
      22,
      -69,
      -100,
      106,
      -72,
      70,
      60,
      18,
      -59,
      15,
      112,
      122,
      -29,
      -98,
      -48,
      82,
      -103,
      -72,
      25,
      63,
      -25,
      -61,
      -23,
      -97,
      -19,
      -101,
      -92,
      -57,
      119,
      102,
      -118,
      -71,
      -100
    ],
    "device_ts_us": 30000,
    "first_word_invalid": false,
    "host_ts_ns": 1786003200000300000,
    "link_id": "rx-a",
    "ltf_mode": "HT",
    "noise_floor_dbm": -99.66,
    "quality": {
      "notes": [],
      "parse_ok": true,
      "sequence_gap": 0,
      "timestamp_monotonic": true
    },
    "rate": 54,
    "rssi_dbm": -67.53,
    "rx_id": "rx-a",
    "schema_version": "1.0.0",
    "secondary_channel": null,
    "seq": 3,
    "session_id": "session-mock-fixed-v1",
    "source_mode": "mock",
    "tx_id_hash": "sha256:f69a37b052c502bed814991c797431b57174118fe41fae92be251727817e64aa"
  },
  {
    "bandwidth_mhz": 20,
    "channel": 6,
    "csi_iq": [
      -50,
      -120,
      -96,
      -103,
      95,
      123,
      85,
      125,
      -66,
      17,
      57,
      -88,
      67,
      74,
      7,
      -77,
      127,
      91,
      -113,
      24,
      -119,
      2,
      104,
      -18,
      82,
      -65,
      -122,
      -81,
      62,
      62,
      -47,
      -28,
      97,
      -62,
      -2,
      105,
      -64,
      75,
      5,
      -26,
      66,
      -91,
      -47,
      4,
      -54,
      49,
      27,
      -56,
      13,
      103,
      -60,
      -42,
      8,
      120,
      -11,
      -63,
      -101,
      106,
      111,
      24,
      117,
      -121,
      -13,
      110,
      125,
      103,
      125,
      -119,
      -19,
      79,
      91,
      52,
      17,
      -53,
      108,
      85,
      31,
      -103,
      -127,
      -128,
      2,
      53,
      18,
      40,
      76,
      -45,
      108,
      -27,
      55,
      -28,
      40,
      26,
      22,
      -38,
      -25,
      126,
      -68,
      -128,
      56,
      43,
      -19,
      -70,
      -52,
      113,
      119,
      10,
      -118,
      37,
      88,
      66,
      74,
      -86,
      -60,
      54,
      -2,
      -118,
      -111,
      -68,
      10,
      -24,
      61,
      127,
      -19,
      42,
      -114,
      -89,
      -30,
      0
    ],
    "device_ts_us": 40000,
    "first_word_invalid": false,
    "host_ts_ns": 1786003200000400000,
    "link_id": "rx-a",
    "ltf_mode": "HT",
    "noise_floor_dbm": -93.67,
    "quality": {
      "notes": [],
      "parse_ok": true,
      "sequence_gap": 0,
      "timestamp_monotonic": true
    },
    "rate": 54,
    "rssi_dbm": -64.97,
    "rx_id": "rx-a",
    "schema_version": "1.0.0",
    "secondary_channel": null,